No,Keyword,Volume,Position,EST.Visits,URL,SEO Difficulty
228,"english tips and tricks",10,74,0,"http://callcentertrainingtips.com/english-tips/",8
229,"what are the questions asked in bpo interview",10,74,0,"http://callcentertrainingtips.com/random-questions",5
230,"contact centre interview questions",10,74,0,"http://callcentertrainingtips.com/call-center-interview-questions-and-suggested-answers",8
231,"tell us more about yourself job application",30,100,0,"http://callcentertrainingtips.com/how-to-answer-tell-me-something-about-yourself-questions/",6
232,"closing spiel for inbound calls",10,75,0,"http://callcentertrainingtips.com/call-flow-complete/",16
233,"call center common interview questions",10,76,0,"http://callcentertrainingtips.com/call-center-interview-questions-and-suggested-answers",10
234,"job interview tell me about yourself no experience",20,91,0,"http://callcentertrainingtips.com/how-to-answer-tell-me-something-about-yourself-questions/",5
235,"tell me about bpo",10,77,0,"http://callcentertrainingtips.com/how-to-answer-tell-me-something-about-yourself-questions/",5
236,"tell about yourself for freshers",10,77,0,"http://callcentertrainingtips.com/how-to-answer-tell-me-something-about-yourself-questions/",5
237,"english tricks",20,93,0,"http://callcentertrainingtips.com/english-tips/",21
238,"tell me something about yourself best answer",20,93,0,"http://callcentertrainingtips.com/how-to-answer-tell-me-something-about-yourself-questions/",5
239,"call center interview answers for freshers",10,78,0,"http://callcentertrainingtips.com/how-to-answer-tell-me-something-about-yourself-questions/",5
240,"call center agent call flow",10,78,0,"http://callcentertrainingtips.com/call-flow-complete/",18
241,"call center application letter no experience",10,78,0,"http://callcentertrainingtips.com/how-to-write-a-resume-for-call-center-application/",36
242,"how to achieve your dream job",10,79,0,"http://callcentertrainingtips.com/dream/",5
243,"question and answer for job interview for call center agent",10,79,0,"http://callcentertrainingtips.com/how-to-answer-tell-me-something-about-yourself-questions/",5
244,"call center jobs means",10,79,0,"http://callcentertrainingtips.com/basics/",13
245,"call centre training activities",10,79,0,"http://callcentertrainingtips.com/english-tips/",14
246,"words that start with a silent t",10,79,0,"http://callcentertrainingtips.com/examples-of-words-with-silent-letters/",5
247,"directory of call centers in the philippines",10,80,0,"http://callcentertrainingtips.com/directory/",30
248,"best opening spiel for customer service",10,80,0,"http://callcentertrainingtips.com/call-flow-complete/",7
249,"best job for shy person",20,96,0,"http://callcentertrainingtips.com/what-can-a-shy-person-do/",7
250,"need process for call center",10,81,0,"http://callcentertrainingtips.com/call-flow-complete/",36
251,"frequently asked question in bpo interview and answers",10,81,0,"http://callcentertrainingtips.com/random-questions",5
252,"call centre processes and procedures",10,81,0,"http://callcentertrainingtips.com/call-flow-complete/",24
253,"being shy at work",20,97,0,"http://callcentertrainingtips.com/what-can-a-shy-person-do/",5
254,"outsourced call center jobs",20,98,0,"http://callcentertrainingtips.com/basics/",34
255,"ano ang english ng maarte",10,82,0,"http://callcentertrainingtips.com/english-tips/",5
256,"can i ask to speak to an english call centre",10,84,0,"http://callcentertrainingtips.com/missed-opportunities",8
257,"call center final interview questions and answers",10,87,0,"http://callcentertrainingtips.com/beginner/",5
258,"englishtips down",10,91,0,"http://callcentertrainingtips.com/english-tips/",18
259,"common interview questions for call center agent",10,91,0,"http://callcentertrainingtips.com/beginner/",5
260,"sample interview questions and answer for call center applicants",10,92,0,"http://callcentertrainingtips.com/random-questions",5
261,"jetstrap alternative",10,92,0,"http://callcentertrainingtips.com/ten-small-things-that-give-me-an-advantage-when-looking-for-work/",18
262,"initial interview call center",10,94,0,"http://callcentertrainingtips.com/reader-submitted-tips-from-waiter-to-call-center-agent/",5
263,"how to answer tell me about yourself for freshers",10,95,0,"http://callcentertrainingtips.com/how-to-answer-tell-me-something-about-yourself-questions/",5
264,"job simulation for call centers",0,20,0,"http://callcentertrainingtips.com/",4
265,"call center training school in quezon city",0,52,0,"http://callcentertrainingtips.com/about/",4
266,"bpo job simulation",0,9,0,"http://callcentertrainingtips.com/",12
