No,Keyword,Volume,Position,EST.Visits,URL,SEO Difficulty
1,"call simulation",210,2,34,"http://callcentertrainingtips.com/call-simulation/",24
2,"call center tips for newbies",50,3,5,"http://callcentertrainingtips.com/beginner/",13
3,"call simulation meaning",10,1,3,"http://callcentertrainingtips.com/call-flow-complete/",16
4,"call center simulation",70,6,2,"http://callcentertrainingtips.com/call-flow-complete/",26
5,"call center basics",20,4,1,"http://callcentertrainingtips.com/basics/",24
6,"call center tips for beginners",70,9,1,"http://callcentertrainingtips.com/beginner/",9
7,"call center tips and tricks",70,9,1,"http://callcentertrainingtips.com/",11
8,"call flow process",30,6,1,"http://callcentertrainingtips.com/call-flow-complete/",14
9,"tell me about yourself call center",10,3,1,"http://callcentertrainingtips.com/how-to-answer-tell-me-something-about-yourself-questions/",15
10,"how to pass call center simulation test",10,3,1,"http://callcentertrainingtips.com/call-flow-complete/",23
11,"call center training tips",20,5,1,"http://callcentertrainingtips.com/",20
12,"basic call center training",30,7,1,"http://callcentertrainingtips.com/basics/",30
13,"call center interview for beginners",10,4,1,"http://callcentertrainingtips.com/beginner/",5
14,"call center tips to get hired",10,4,1,"http://callcentertrainingtips.com/",5
15,"tell me about yourself best answer for call center",10,4,1,"http://callcentertrainingtips.com/how-to-answer-tell-me-something-about-yourself-questions/",5
16,"call center agent tricks",30,8,1,"http://callcentertrainingtips.com/",14
17,"tell me something about yourself in bpo interview",10,5,0,"http://callcentertrainingtips.com/how-to-answer-tell-me-something-about-yourself-questions/",5
18,"product training call center",10,5,0,"http://callcentertrainingtips.com/how-to-pass-call-center-training/",36
19,"call center training app",30,10,0,"http://callcentertrainingtips.com/",28
20,"tell me about yourself best answer for call center interview",10,6,0,"http://callcentertrainingtips.com/how-to-answer-tell-me-something-about-yourself-questions/",5
21,"call center interview tips and tricks",10,6,0,"http://callcentertrainingtips.com/beginner/",5
22,"call center simulation practice test",20,9,0,"http://callcentertrainingtips.com/call-flow-complete/",22
23,"working in a call center tips",170,14,0,"http://callcentertrainingtips.com/",12
24,"alorica centris landline number",10,9,0,"http://callcentertrainingtips.com/directory/",5
25,"easy simulations call center",10,9,0,"http://callcentertrainingtips.com/call-flow-complete/",17
26,"call centre simulation test",90,13,0,"http://callcentertrainingtips.com/call-flow-complete/",24
27,"free call center simulation practice test",30,11,0,"http://callcentertrainingtips.com/call-flow-complete/",16
28,"call center interview questions and answers for beginners",20,11,0,"http://callcentertrainingtips.com/beginner/",8
29,"call center on resume",1900,41,0,"http://callcentertrainingtips.com/how-to-write-a-resume-for-call-center-application/",9
30,"words with silent letter s",2400,44,0,"http://callcentertrainingtips.com/examples-of-words-with-silent-letters/",6
31,"call center job tips",30,14,0,"http://callcentertrainingtips.com/",8
32,"how to prepare for call center job",10,11,0,"http://callcentertrainingtips.com/",10
33,"call center tips interview",30,16,0,"http://callcentertrainingtips.com/beginner/",6
34,"tell me something about yourself example",210,29,0,"http://callcentertrainingtips.com/how-to-answer-tell-me-something-about-yourself-questions/",6
35,"is b silent in plumber",10,12,0,"http://callcentertrainingtips.com/examples-of-words-with-silent-letters/",19
36,"meaning of simulate call",10,12,0,"http://callcentertrainingtips.com/call-flow-complete/",5
37,"tips on interview in call center",30,18,0,"http://callcentertrainingtips.com/beginner/",7
38,"call center customer service training tips",10,13,0,"http://callcentertrainingtips.com/",22
39,"lifehacker tips",260,34,0,"http://callcentertrainingtips.com/lessons-lifehacker/",20
40,"call center computers",30,19,0,"http://callcentertrainingtips.com/basics/",42
41,"tips for interview in call center",30,19,0,"http://callcentertrainingtips.com/beginner/",7
42,"versant test",260,35,0,"http://callcentertrainingtips.com/versant/",19
43,"call center final interview questions and answers for first timers",10,14,0,"http://callcentertrainingtips.com/beginner/",5
44,"actual call center interview",10,14,0,"http://callcentertrainingtips.com/beginner/",5
45,"alorica eton centris",10,14,0,"http://callcentertrainingtips.com/directory/",13
46,"free call center training for high school graduate",10,14,0,"http://callcentertrainingtips.com/about/",18
47,"expert call center",10,14,0,"http://callcentertrainingtips.com/how-to-become-an-expert-call-center-agent-by-knowing-the-basics/",29
48,"tips for call center agents",30,20,0,"http://callcentertrainingtips.com/",12
49,"alorica mall of asia",10,15,0,"http://callcentertrainingtips.com/directory/",5
50,"how to pass the interview in call center",10,15,0,"http://callcentertrainingtips.com/beginner/",5
51,"about call center interview questions",1000,57,0,"http://callcentertrainingtips.com/call-center-interview-questions-and-suggested-answers",8
52,"english for maarte",1000,57,0,"http://callcentertrainingtips.com/english-tips/",13
53,"alorica centris address",10,16,0,"http://callcentertrainingtips.com/directory/",13
54,"alorica mezza address",10,16,0,"http://callcentertrainingtips.com/directory/",13
55,"opening spiel for customer service",20,21,0,"http://callcentertrainingtips.com/call-flow-complete/",7
56,"resume for call center agent",170,38,0,"http://callcentertrainingtips.com/how-to-write-a-resume-for-call-center-application/",7
57,"training for call center agent",50,28,0,"http://callcentertrainingtips.com/",18
58,"lifehacker interview",20,22,0,"http://callcentertrainingtips.com/hundreds-of-job-application-lessons-from-lifehacker/",18
59,"call center interview questions",1000,65,0,"http://callcentertrainingtips.com/call-center-interview-questions-and-suggested-answers",6
60,"alorica alphaland contact number",10,19,0,"http://callcentertrainingtips.com/directory/",5
61,"spiel in call center",30,26,0,"http://callcentertrainingtips.com/call-flow-complete/",13
62,"call center quality assurance interview questions",110,38,0,"http://callcentertrainingtips.com/call-center-interview-questions-and-suggested-answers",16
63,"call center reviewer",40,29,0,"http://callcentertrainingtips.com/start/",33
64,"sample resume for call center agent without experience",10,20,0,"http://callcentertrainingtips.com/how-to-write-a-resume-for-call-center-application/",5
65,"call center process flow",30,28,0,"http://callcentertrainingtips.com/call-flow-complete/",19
66,"call center school answers",10,21,0,"http://callcentertrainingtips.com/start/",13
67,"challenge accepted challenge completed",10,22,0,"http://callcentertrainingtips.com/why-you-should-say-challenge-accepted/",5
68,"tech support call flow",10,22,0,"http://callcentertrainingtips.com/call-flow-complete/",18
69,"something about me",170,48,0,"http://callcentertrainingtips.com/how-to-answer-tell-me-something-about-yourself-questions/",14
70,"red and blue call center",20,27,0,"http://callcentertrainingtips.com/random-questions",7
71,"call center training techniques",20,27,0,"http://callcentertrainingtips.com/",26
72,"call center agent resume",140,46,0,"http://callcentertrainingtips.com/how-to-write-a-resume-for-call-center-application/",9
73,"call flow customer service",70,39,0,"http://callcentertrainingtips.com/call-flow-complete/",11
74,"call center experience on resume",90,42,0,"http://callcentertrainingtips.com/how-to-build-a-call-center-resume-from-scratch-no-work-experience/",8
75,"customer service simulation test",20,28,0,"http://callcentertrainingtips.com/call-flow-complete/",13
76,"questions and answers for call center interview",110,45,0,"http://callcentertrainingtips.com/answer-questions/",8
77,"versant exam",20,29,0,"http://callcentertrainingtips.com/versant/",18
78,"call center high school graduate",10,24,0,"http://callcentertrainingtips.com/about/",18
79,"skills for call center resume",590,72,0,"http://callcentertrainingtips.com/start/",7
80,"alorica mj plaza",20,30,0,"http://callcentertrainingtips.com/directory/",13
81,"sample resume for call center agent",20,30,0,"http://callcentertrainingtips.com/how-to-write-a-resume-for-call-center-application/",10
82,"alorica export bank",10,25,0,"http://callcentertrainingtips.com/directory/",13
83,"what is your weakness call center interview",10,25,0,"http://callcentertrainingtips.com/how-to-connect-your-strength-weakness-or-experience-to-why-you-want-to-work-in-a-call-center/",5
84,"call center resume sample no experience",70,43,0,"http://callcentertrainingtips.com/how-to-write-a-resume-for-call-center-application/",7
85,"words with silent d",110,49,0,"http://callcentertrainingtips.com/examples-of-words-with-silent-letters/",5
86,"question and answer call center interview",110,49,0,"http://callcentertrainingtips.com/call-center-interview-questions-and-suggested-answers",13
87,"lifehacker cover letter",20,31,0,"http://callcentertrainingtips.com/hundreds-of-job-application-lessons-from-lifehacker/",13
88,"how to pass an interview for a call center agent",10,26,0,"http://callcentertrainingtips.com/beginner/",5
89,"mj corporate plaza contact number",10,26,0,"http://callcentertrainingtips.com/directory/",5
90,"teleperformance southgate",90,48,0,"http://callcentertrainingtips.com/directory/",19
91,"tell me something interesting about yourself sample answers",40,39,0,"http://callcentertrainingtips.com/how-to-answer-tell-me-something-about-yourself-questions/",5
92,"sample resume format for call center agent without experience",10,27,0,"http://callcentertrainingtips.com/how-to-write-a-resume-for-call-center-application/",5
93,"call center training with allowance",10,27,0,"http://callcentertrainingtips.com/complete-money",5
94,"exercises for call center agents",10,27,0,"http://callcentertrainingtips.com/",18
95,"questions in applying call center",10,27,0,"http://callcentertrainingtips.com/random-questions",5
96,"how to make a resume for call center job",10,27,0,"http://callcentertrainingtips.com/how-to-write-a-resume-for-call-center-application/",11
97,"call centre quality assurance interview questions and answers",10,28,0,"http://callcentertrainingtips.com/call-center-interview-questions-and-suggested-answers",15
98,"call center video training",20,34,0,"http://callcentertrainingtips.com/basics/",29
99,"interview questions for quality assurance in call center",70,49,0,"http://callcentertrainingtips.com/call-center-interview-questions-and-suggested-answers",11
100,"call center interview scenario questions",10,29,0,"http://callcentertrainingtips.com/random-questions",5
101,"teleperformance shaw contact number",10,29,0,"http://callcentertrainingtips.com/directory/",5
102,"free call center training with allowance",10,29,0,"http://callcentertrainingtips.com/complete-money",14
103,"call center interview skills",10,29,0,"http://callcentertrainingtips.com/beginner/",5
104,"call center test questions and answers",50,45,0,"http://callcentertrainingtips.com/how-to-answer-tell-me-something-about-yourself-questions/",17
105,"what is a work shy person",40,43,0,"http://callcentertrainingtips.com/what-can-a-shy-person-do/",5
106,"how to make a resume for call center agent",10,30,0,"http://callcentertrainingtips.com/how-to-write-a-resume-for-call-center-application/",5
107,"call center resume with experience",10,30,0,"http://callcentertrainingtips.com/how-to-write-a-resume-for-call-center-application/",5
108,"teleperformance it park cebu phone number",10,31,0,"http://callcentertrainingtips.com/directory/",5
109,"vaudevillian pronunciation",50,48,0,"http://callcentertrainingtips.com/english-tips/",18
110,"words with letters salmon",110,60,0,"http://callcentertrainingtips.com/examples-of-words-with-silent-letters/",5
111,"words with silent u in them",10,32,0,"http://callcentertrainingtips.com/examples-of-words-with-silent-letters/",5
112,"sample interview questions for call center applicants",10,32,0,"http://callcentertrainingtips.com/beginner/",16
113,"call center spiels for irate customer",10,32,0,"http://callcentertrainingtips.com/call-flow-complete/",18
114,"situational questions for call center interviews",10,32,0,"http://callcentertrainingtips.com/random-questions",14
115,"possible question in applying call center",10,32,0,"http://callcentertrainingtips.com/random-questions",23
116,"customer service call center interview questions and answers",140,65,0,"http://callcentertrainingtips.com/call-center-interview-questions-and-suggested-answers",14
117,"i am a shy person",30,44,0,"http://callcentertrainingtips.com/what-can-a-shy-person-do/",5
118,"alorica philippines contact number",10,33,0,"http://callcentertrainingtips.com/directory/",7
119,"how to make a resume philippines",10,34,0,"http://callcentertrainingtips.com/how-to-write-a-resume-for-call-center-application/",23
120,"call center resume tips",10,34,0,"http://callcentertrainingtips.com/how-to-write-a-resume-for-call-center-application/",5
121,"tell me something about you",110,65,0,"http://callcentertrainingtips.com/how-to-answer-tell-me-something-about-yourself-questions/",5
122,"random questions to answer",210,77,0,"http://callcentertrainingtips.com/random-questions",6
123,"tell me about yourself sample answer for freshers",390,91,0,"http://callcentertrainingtips.com/how-to-answer-tell-me-something-about-yourself-questions/",6
124,"call center online training",20,42,0,"http://callcentertrainingtips.com/",26
125,"american culture training",10,35,0,"http://callcentertrainingtips.com/american-culture/",23
126,"youtube call center training",10,35,0,"http://callcentertrainingtips.com/youtube/",31
127,"how to answer interview in call center",10,35,0,"http://callcentertrainingtips.com/call-center-interview-questions-and-suggested-answers",5
128,"another word for work shy person",40,51,0,"http://callcentertrainingtips.com/what-can-a-shy-person-do/",5
129,"examples of silent letters",20,43,0,"http://callcentertrainingtips.com/examples-of-words-with-silent-letters/",5
130,"how to be hired in a call center",10,36,0,"http://callcentertrainingtips.com/",5
131,"tell me something about yourself call center interview",10,36,0,"http://callcentertrainingtips.com/call-center-interview-questions-and-suggested-answers",5
132,"resume for bpo jobs",10,36,0,"http://callcentertrainingtips.com/how-to-write-a-resume-for-call-center-application/",18
133,"how to answer a call center interview",10,37,0,"http://callcentertrainingtips.com/answer-questions/",5
134,"resume sample in philippines",20,45,0,"http://callcentertrainingtips.com/how-to-write-a-resume-for-call-center-application/",7
135,"can you tell me something about yourself",20,45,0,"http://callcentertrainingtips.com/how-to-answer-tell-me-something-about-yourself-questions/",6
136,"why are call centers always hiring",90,67,0,"http://callcentertrainingtips.com/basics/",8
137,"alorica centris",10,38,0,"http://callcentertrainingtips.com/directory/",18
138,"what is maarte in english",40,56,0,"http://callcentertrainingtips.com/english-tips/",5
139,"preparation for call center interview",10,39,0,"http://callcentertrainingtips.com/call-center-interview-questions-and-suggested-answers",18
140,"some question in call center interview",10,39,0,"http://callcentertrainingtips.com/random-questions",5
141,"call center hiring tagalog speaking",10,39,0,"http://callcentertrainingtips.com/missed-opportunities",5
142,"why should we hire you as a call center agent",10,39,0,"http://callcentertrainingtips.com/call-center-interview-questions-and-suggested-answers",5
143,"training for call center agents philippines",10,39,0,"http://callcentertrainingtips.com/",5
144,"a work shy person",90,70,0,"http://callcentertrainingtips.com/what-can-a-shy-person-do/",6
145,"silent d words",110,74,0,"http://callcentertrainingtips.com/examples-of-words-with-silent-letters/",14
146,"sample resume for bpo jobs",10,40,0,"http://callcentertrainingtips.com/how-to-write-a-resume-for-call-center-application/",5
147,"versant test questions",10,40,0,"http://callcentertrainingtips.com/versant/",18
148,"tell me about yourself interview call center",10,40,0,"http://callcentertrainingtips.com/beginner/",5
149,"random questions to ask in an interview",20,49,0,"http://callcentertrainingtips.com/random-questions",5
150,"why did you apply in a call center",10,41,0,"http://callcentertrainingtips.com/basics/",5
151,"call handling process flow",10,41,0,"http://callcentertrainingtips.com/call-flow-complete/",9
152,"closing spiel in call center",10,41,0,"http://callcentertrainingtips.com/write-spiel/",5
153,"call centers in quezon avenue",10,42,0,"http://callcentertrainingtips.com/directory/",5
154,"call center training manila",10,42,0,"http://callcentertrainingtips.com/",17
155,"call center interview questions in the philippines",10,42,0,"http://callcentertrainingtips.com/random-questions",14
156,"self esteem interview questions",20,51,0,"http://callcentertrainingtips.com/how-to-answer-difficult-interview-questions-if-you-have-low-self-esteem/",7
157,"call center common questions",10,43,0,"http://callcentertrainingtips.com/call-center-interview-questions-and-suggested-answers",5
158,"how to pass a call center interview",10,43,0,"http://callcentertrainingtips.com/",8
159,"alorica export bank makati",10,43,0,"http://callcentertrainingtips.com/directory/",5
160,"basic english for call center",10,44,0,"http://callcentertrainingtips.com/missed-opportunities",5
161,"how much do you make in a call center",20,53,0,"http://callcentertrainingtips.com/complete-money",8
162,"skills for a call center job",20,53,0,"http://callcentertrainingtips.com/basics/",6
163,"how fast can deadpool heal",40,64,0,"http://callcentertrainingtips.com/deadpool/",5
164,"i know the answer to every question",70,75,0,"http://callcentertrainingtips.com/avoid-fillers-and-answer-every-question-with-delaying-tactics/",5
165,"teleperformance bgc",10,45,0,"http://callcentertrainingtips.com/directory/",18
166,"call centre jobs interview questions",90,81,0,"http://callcentertrainingtips.com/answer-questions/",7
167,"call center local account tagalog",10,46,0,"http://callcentertrainingtips.com/missed-opportunities",5
168,"call center interview example",10,46,0,"http://callcentertrainingtips.com/beginner/",5
169,"common question in job interview call center agent",10,47,0,"http://callcentertrainingtips.com/call-center-interview-questions-and-suggested-answers",5
170,"call center questions to ask",10,47,0,"http://callcentertrainingtips.com/call-center-interview-questions-and-suggested-answers",13
171,"service center process flow",10,47,0,"http://callcentertrainingtips.com/call-flow-complete/",5
172,"why should we hire you best answer in call center",10,48,0,"http://callcentertrainingtips.com/answer-questions/",5
173,"how to answer job interview questions in call center",10,48,0,"http://callcentertrainingtips.com/call-center-interview-questions-and-suggested-answers",5
174,"tell me something about yourself answer",70,80,0,"http://callcentertrainingtips.com/how-to-answer-tell-me-something-about-yourself-questions/",6
175,"customer service call center interview questions",50,74,0,"http://callcentertrainingtips.com/call-center-interview-questions-and-suggested-answers",12
176,"convergys one building",10,49,0,"http://callcentertrainingtips.com/directory/",13
177,"question and answer call center",10,49,0,"http://callcentertrainingtips.com/how-to-answer-tell-me-something-about-yourself-questions/",13
178,"tell me about yourself sample answer for fresh graduate",110,93,0,"http://callcentertrainingtips.com/how-to-answer-tell-me-something-about-yourself-questions/",6
179,"jobs for people who can t speak english",10,51,0,"http://callcentertrainingtips.com/missed-opportunities",10
180,"why work in a call center interview answer",10,51,0,"http://callcentertrainingtips.com/call-center-interview-questions-and-suggested-answers",5
181,"call center training exercises",10,52,0,"http://callcentertrainingtips.com/",13
182,"plumber pronunciation audio",10,52,0,"http://callcentertrainingtips.com/examples-of-words-with-silent-letters/",13
183,"call center fillers",10,52,0,"http://callcentertrainingtips.com/avoid-fillers-and-answer-every-question-with-delaying-tactics/",33
184,"customer service call center tips",90,93,0,"http://callcentertrainingtips.com/call-simulation/",24
185,"versant test questions and answers",10,53,0,"http://callcentertrainingtips.com/versant/",11
186,"why should we hire you call center interview",10,53,0,"http://callcentertrainingtips.com/answer-questions/",5
187,"why should we hire you call center",10,54,0,"http://callcentertrainingtips.com/call-center-interview-questions-and-suggested-answers",7
188,"call center english speaking training",10,54,0,"http://callcentertrainingtips.com/missed-opportunities",36
189,"words with silent letters in them",10,54,0,"http://callcentertrainingtips.com/examples-of-words-with-silent-letters/",6
190,"call center objectives for newbies",10,54,0,"http://callcentertrainingtips.com/call-center-interview-questions-and-suggested-answers",5
191,"crazy random questions",70,91,0,"http://callcentertrainingtips.com/random-questions",13
192,"job for shy person",20,66,0,"http://callcentertrainingtips.com/what-can-a-shy-person-do/",8
193,"a shy person",70,92,0,"http://callcentertrainingtips.com/what-can-a-shy-person-do/",13
194,"tell about yourself sample answer",40,80,0,"http://callcentertrainingtips.com/how-to-answer-tell-me-something-about-yourself-questions/",12
195,"what is a shy person",20,67,0,"http://callcentertrainingtips.com/what-can-a-shy-person-do/",6
196,"best answer in call center interview",10,56,0,"http://callcentertrainingtips.com/",5
197,"random scenario questions",20,68,0,"http://callcentertrainingtips.com/random-questions",13
198,"how to answer interview question in call center",10,57,0,"http://callcentertrainingtips.com/call-center-interview-questions-and-suggested-answers",5
199,"tell me about yourself answer for fresher",30,76,0,"http://callcentertrainingtips.com/how-to-answer-tell-me-something-about-yourself-questions/",6
200,"what is your advantage to other applicants answer",10,59,0,"http://callcentertrainingtips.com/call-center-interview-questions-and-suggested-answers",5
201,"possible question in call center interview",10,59,0,"http://callcentertrainingtips.com/beginner/",5
202,"two ecom center tower b",10,59,0,"http://callcentertrainingtips.com/directory/",5
203,"how to train call center agents",10,61,0,"http://callcentertrainingtips.com/",21
204,"common question in call center interview and answers",10,61,0,"http://callcentertrainingtips.com/answer-questions/",7
205,"how to do a resume with no work experience",50,93,0,"http://callcentertrainingtips.com/how-to-build-a-call-center-resume-from-scratch-no-work-experience/",9
206,"say something interesting about yourself",30,82,0,"http://callcentertrainingtips.com/how-to-answer-tell-me-something-about-yourself-questions/",5
207,"commonly question in call center interview",20,74,0,"http://callcentertrainingtips.com/answer-questions/",6
208,"call center school philippines",10,62,0,"http://callcentertrainingtips.com/start/",5
209,"tell me about yourself examples no experience",40,89,0,"http://callcentertrainingtips.com/how-to-answer-tell-me-something-about-yourself-questions/",6
210,"how to make resume for call center",10,63,0,"http://callcentertrainingtips.com/how-to-build-a-call-center-resume-from-scratch-no-work-experience/",6
211,"pronunciation sheet",10,63,0,"http://callcentertrainingtips.com/my-pronunciation-cheat-sheet/",18
212,"a timid person",30,84,0,"http://callcentertrainingtips.com/what-can-a-shy-person-do/",13
213,"call center training games",20,78,0,"http://callcentertrainingtips.com/basics/",23
214,"call center scenario",20,78,0,"http://callcentertrainingtips.com/random-questions",23
215,"jobs for timid people",10,66,0,"http://callcentertrainingtips.com/what-can-a-shy-person-do/",7
216,"how to call a waiter",20,82,0,"http://callcentertrainingtips.com/reader-submitted-tips-from-waiter-to-call-center-agent/",6
217,"curriculum vitae sample format philippines",10,69,0,"http://callcentertrainingtips.com/how-to-write-a-resume-for-call-center-application/",5
218,"call center agent description resume",10,69,0,"http://callcentertrainingtips.com/how-to-write-a-resume-for-call-center-application/",6
219,"resume in the philippines",20,83,0,"http://callcentertrainingtips.com/how-to-write-a-resume-for-call-center-application/",9
220,"common question for call center interview",10,70,0,"http://callcentertrainingtips.com/answer-questions/",5
221,"english speaking tips and tricks",10,70,0,"http://callcentertrainingtips.com/english-tips/",5
222,"how to apply call center agent",10,71,0,"http://callcentertrainingtips.com/beginner/",5
223,"sample interview questions and answers for call center agent",10,71,0,"http://callcentertrainingtips.com/how-to-answer-tell-me-something-about-yourself-questions/",5
224,"call center interview in philippines",10,73,0,"http://callcentertrainingtips.com/random-questions",18
225,"hold procedure call center",10,73,0,"http://callcentertrainingtips.com/call-simulation/",11
226,"call center companies in cubao",10,73,0,"http://callcentertrainingtips.com/directory/",36
227,"call center interview questions for experienced",10,73,0,"http://callcentertrainingtips.com/call-center-interview-questions-and-suggested-answers",5
